file_name,file_path,title,author,key,reason
praise like fireworks i98398,C:\Users\littl\Documents\Codex Projects\worship-song-finder\data\raw\opensong\praise like fireworks i98398,Praise Like Fireworks,Rend collective,,missing_chords
praise the lord i63992,C:\Users\littl\Documents\Codex Projects\worship-song-finder\data\raw\opensong\praise the lord i63992,Praise The Lord,,A,"missing_author,missing_chords"
praise the lord together i105323,C:\Users\littl\Documents\Codex Projects\worship-song-finder\data\raw\opensong\praise the lord together i105323,Praise the Lord together,,,"missing_author,missing_chords"
praise the name of jesus i64274,C:\Users\littl\Documents\Codex Projects\worship-song-finder\data\raw\opensong\praise the name of jesus i64274,Praise The Name of Jesus,,,"missing_author,missing_chords"
praising the lord i105150,C:\Users\littl\Documents\Codex Projects\worship-song-finder\data\raw\opensong\praising the lord i105150,Praising the Lord,,,"missing_author,missing_chords"
prayer after pardon i11279,C:\Users\littl\Documents\Codex Projects\worship-song-finder\data\raw\opensong\prayer after pardon i11279,Prayer After Pardon,"Hullah, John Pyke (1812-1884), Bright, William (1824-1901)",D,missing_chords
prayer for blessings i3858,C:\Users\littl\Documents\Codex Projects\worship-song-finder\data\raw\opensong\prayer for blessings i3858,Prayer for Blessings,Turgay Üçal,,missing_chords
precious lord take my hand i64417,C:\Users\littl\Documents\Codex Projects\worship-song-finder\data\raw\opensong\precious lord take my hand i64417,"Precious Lord, take my hand",,E,"missing_author,missing_chords"
prepare the way i110399,C:\Users\littl\Documents\Codex Projects\worship-song-finder\data\raw\opensong\prepare the way i110399,Prepare The Way,Don Potter,,missing_chords
presence power and glory i76231,C:\Users\littl\Documents\Codex Projects\worship-song-finder\data\raw\opensong\presence power and glory i76231,"Presence, Power and Glory",Citipointe Worship,Em,missing_chords
promised land feat tedashii i54478,C:\Users\littl\Documents\Codex Projects\worship-song-finder\data\raw\opensong\promised land feat tedashii i54478,Promised Land (feat. Tedashii),,,"missing_author,missing_chords"
psalm 1391516 i48378,C:\Users\littl\Documents\Codex Projects\worship-song-finder\data\raw\opensong\psalm 1391516 i48378,Psalm 139:15-16,Rivers & Robots,,missing_chords
psalm 150 matt boswell and matt papa i108798,C:\Users\littl\Documents\Codex Projects\worship-song-finder\data\raw\opensong\psalm 150 matt boswell and matt papa i108798,Psalm 150 (Matt Boswell and Matt Papa),,G,missing_author
psalm 19 may the words of my mouth i108742,C:\Users\littl\Documents\Codex Projects\worship-song-finder\data\raw\opensong\psalm 19 may the words of my mouth i108742,Psalm 19 May The Words Of My Mouth,,C,missing_author
psalm 23 i4719,C:\Users\littl\Documents\Codex Projects\worship-song-finder\data\raw\opensong\psalm 23 i4719,Psalm 23,,E,missing_author
psalm 3 i98735,C:\Users\littl\Documents\Codex Projects\worship-song-finder\data\raw\opensong\psalm 3 i98735,psalm 3,Freda Tapp,,missing_chords
psalm 90 i104717,C:\Users\littl\Documents\Codex Projects\worship-song-finder\data\raw\opensong\psalm 90 i104717,Psalm 90,Shane Barnard,,missing_chords
psalm 91 i48625,C:\Users\littl\Documents\Codex Projects\worship-song-finder\data\raw\opensong\psalm 91 i48625,Psalm 91,Jonathan Ogden,,missing_chords
pursue i46387,C:\Users\littl\Documents\Codex Projects\worship-song-finder\data\raw\opensong\pursue i46387,Pursue,"Hillsong Young & Free, Aodhan King & Hannah Hobbs",G#m,missing_chords
put your hand in the hand of the man who stilled the water i87063,C:\Users\littl\Documents\Codex Projects\worship-song-finder\data\raw\opensong\put your hand in the hand of the man who stilled the water i87063,Put your hand in the hand of the Man who stilled the water,,E,missing_author
rain down i1829,C:\Users\littl\Documents\Codex Projects\worship-song-finder\data\raw\opensong\rain down i1829,Rain Down,,A,missing_author
rain reign i47572,C:\Users\littl\Documents\Codex Projects\worship-song-finder\data\raw\opensong\rain reign i47572,Rain / Reign,Hillsong United,,missing_chords
reach out touch the lord i64396,C:\Users\littl\Documents\Codex Projects\worship-song-finder\data\raw\opensong\reach out touch the lord i64396,"Reach Out, Touch The Lord",,D,missing_author
read your bible pray every day i9663,C:\Users\littl\Documents\Codex Projects\worship-song-finder\data\raw\opensong\read your bible pray every day i9663,"Read Your Bible, Pray Every Day",,,"missing_author,missing_chords"
reason to sing i89974,C:\Users\littl\Documents\Codex Projects\worship-song-finder\data\raw\opensong\reason to sing i89974,Reason to Sing,,,"missing_author,missing_chords"
rebel heart i54988,C:\Users\littl\Documents\Codex Projects\worship-song-finder\data\raw\opensong\rebel heart i54988,Rebel Heart,,,"missing_author,missing_chords"
receive the power i101318,C:\Users\littl\Documents\Codex Projects\worship-song-finder\data\raw\opensong\receive the power i101318,Receive the Power,"Guy Sebastian, Gary Pinto",,missing_chords
reign in me i3597,C:\Users\littl\Documents\Codex Projects\worship-song-finder\data\raw\opensong\reign in me i3597,Reign in me,,G,missing_author
rejoice emmanuel is in our midst i106960,C:\Users\littl\Documents\Codex Projects\worship-song-finder\data\raw\opensong\rejoice emmanuel is in our midst i106960,"REJOICE, EMMANUEL IS IN OUR MIDST",,,"missing_author,missing_chords"
rejoice i25518,C:\Users\littl\Documents\Codex Projects\worship-song-finder\data\raw\opensong\rejoice i25518,Rejoice!,Graham Kendrick,,missing_chords
rejoice i42388,C:\Users\littl\Documents\Codex Projects\worship-song-finder\data\raw\opensong\rejoice i42388,Rejoice,"Chris Tomlin, Ed Cash, Jesse Reeves",,missing_chords
rejoice not over me i106333,C:\Users\littl\Documents\Codex Projects\worship-song-finder\data\raw\opensong\rejoice not over me i106333,Rejoice not over me,,Em,"missing_author,missing_chords"
rejoice o israel i88700,C:\Users\littl\Documents\Codex Projects\worship-song-finder\data\raw\opensong\rejoice o israel i88700,Rejoice O Israel,Paul Wilbur,,missing_chords
relent i1886,C:\Users\littl\Documents\Codex Projects\worship-song-finder\data\raw\opensong\relent i1886,Relent,,,"missing_author,missing_chords"
remembrance i48148,C:\Users\littl\Documents\Codex Projects\worship-song-finder\data\raw\opensong\remembrance i48148,Remembrance,Hillsong Worship,,missing_chords
renew us in this day i54780,C:\Users\littl\Documents\Codex Projects\worship-song-finder\data\raw\opensong\renew us in this day i54780,Renew us in this day,Jesus Culture,,missing_chords
renew us in this day i55089,C:\Users\littl\Documents\Codex Projects\worship-song-finder\data\raw\opensong\renew us in this day i55089,Renew us in this day,Jesus Culture,,missing_chords
rescue i2692,C:\Users\littl\Documents\Codex Projects\worship-song-finder\data\raw\opensong\rescue i2692,Rescue,,D,missing_author
rescue i55303,C:\Users\littl\Documents\Codex Projects\worship-song-finder\data\raw\opensong\rescue i55303,Rescue,,,"missing_author,missing_chords"
rescue i55313,C:\Users\littl\Documents\Codex Projects\worship-song-finder\data\raw\opensong\rescue i55313,Rescue,,,"missing_author,missing_chords"
resting leaning on the everlasting arms i7044,C:\Users\littl\Documents\Codex Projects\worship-song-finder\data\raw\opensong\resting leaning on the everlasting arms i7044,Resting (Leaning) on the everlasting arms,,G,missing_author
resurrection power i105547,C:\Users\littl\Documents\Codex Projects\worship-song-finder\data\raw\opensong\resurrection power i105547,Resurrection Power,Carol Cymbala,,missing_chords
resurrender i103167,C:\Users\littl\Documents\Codex Projects\worship-song-finder\data\raw\opensong\resurrender i103167,Re-surrender,,,"missing_author,missing_chords"
rising up i64538,C:\Users\littl\Documents\Codex Projects\worship-song-finder\data\raw\opensong\rising up i64538,Rising up,,E,missing_author
river of life i63995,C:\Users\littl\Documents\Codex Projects\worship-song-finder\data\raw\opensong\river of life i63995,River Of Life,,,"missing_author,missing_chords"
river wash over me i1510,C:\Users\littl\Documents\Codex Projects\worship-song-finder\data\raw\opensong\river wash over me i1510,"River, wash over me","Dougie Brown, D. Peacock",,missing_chords
rock of ages i7835,C:\Users\littl\Documents\Codex Projects\worship-song-finder\data\raw\opensong\rock of ages i7835,Rock of Ages,"Paul Baloche, Hastings, Thomas (1784-1872), Toplady, Augustus Montague (1740-1778)",Bb,missing_chords
rocking i6802,C:\Users\littl\Documents\Codex Projects\worship-song-finder\data\raw\opensong\rocking i6802,Rocking,,,"missing_author,missing_chords"
roll over the ocean i87640,C:\Users\littl\Documents\Codex Projects\worship-song-finder\data\raw\opensong\roll over the ocean i87640,Roll Over The Ocean,,,"missing_author,missing_chords"
roni roni bat zion i64636,C:\Users\littl\Documents\Codex Projects\worship-song-finder\data\raw\opensong\roni roni bat zion i64636,Roni Roni Bat Zion,,Em,"missing_author,missing_chords"
rooftop i11383,C:\Users\littl\Documents\Codex Projects\worship-song-finder\data\raw\opensong\rooftop i11383,Rooftop,Jesus Culture,Bm,missing_chords
room at the fountain i64384,C:\Users\littl\Documents\Codex Projects\worship-song-finder\data\raw\opensong\room at the fountain i64384,Room at the Fountain,,,"missing_author,missing_chords"
run wild i55291,C:\Users\littl\Documents\Codex Projects\worship-song-finder\data\raw\opensong\run wild i55291,Run wild,,,"missing_author,missing_chords"
run with the message i64045,C:\Users\littl\Documents\Codex Projects\worship-song-finder\data\raw\opensong\run with the message i64045,Run with the Message,,,"missing_author,missing_chords"
rw battle belongs i105749,C:\Users\littl\Documents\Codex Projects\worship-song-finder\data\raw\opensong\rw battle belongs i105749,RW: Battle Belongs,,G,missing_author
rw raise a hallelujah i105748,C:\Users\littl\Documents\Codex Projects\worship-song-finder\data\raw\opensong\rw raise a hallelujah i105748,RW: Raise a Hallelujah,,C,missing_author
salvation i64649,C:\Users\littl\Documents\Codex Projects\worship-song-finder\data\raw\opensong\salvation i64649,(S-A-L-V-A-T-I-O-N),,F,"missing_author,missing_chords"
salvation is here i5201,C:\Users\littl\Documents\Codex Projects\worship-song-finder\data\raw\opensong\salvation is here i5201,Salvation is Here,,,"missing_author,missing_chords"
same god i101241,C:\Users\littl\Documents\Codex Projects\worship-song-finder\data\raw\opensong\same god i101241,same god,,,"missing_author,missing_chords"
satisfy us with your love i104717,C:\Users\littl\Documents\Codex Projects\worship-song-finder\data\raw\opensong\satisfy us with your love i104717,Satisfy Us with Your Love,Shane Barnard,,missing_chords
saving grace i4862,C:\Users\littl\Documents\Codex Projects\worship-song-finder\data\raw\opensong\saving grace i4862,Saving Grace,,E,missing_author
savior crucified i46947,C:\Users\littl\Documents\Codex Projects\worship-song-finder\data\raw\opensong\savior crucified i46947,Savior Crucified,Warr Acres,,missing_chords
say to the lord i love you i75973,C:\Users\littl\Documents\Codex Projects\worship-song-finder\data\raw\opensong\say to the lord i love you i75973,"Say to the Lord ""I love you""",,,"missing_author,missing_chords"
scandal of grace i7684,C:\Users\littl\Documents\Codex Projects\worship-song-finder\data\raw\opensong\scandal of grace i7684,Scandal of Grace,Hillsong,,missing_chords
sea of faces i53114,C:\Users\littl\Documents\Codex Projects\worship-song-finder\data\raw\opensong\sea of faces i53114,Sea Of Faces,,,"missing_author,missing_chords"
search me o god i7521,C:\Users\littl\Documents\Codex Projects\worship-song-finder\data\raw\opensong\search me o god i7521,Search Me O God,,,"missing_author,missing_chords"
see his love i821,C:\Users\littl\Documents\Codex Projects\worship-song-finder\data\raw\opensong\see his love i821,See His Love,,,"missing_author,missing_chords"
see the conqueror mounts in triumph i11235,C:\Users\littl\Documents\Codex Projects\worship-song-finder\data\raw\opensong\see the conqueror mounts in triumph i11235,"See, the Conqueror Mounts in Triumph","Smart, Henry Thomas (1813-1879), Wordsworth, Christopher (1807-1885)",A,missing_chords
see the lord ascends in triumph i11235,C:\Users\littl\Documents\Codex Projects\worship-song-finder\data\raw\opensong\see the lord ascends in triumph i11235,"See, The Lord Ascends In Triumph","Smart, Henry Thomas (1813-1879), Wordsworth, Christopher (1807-1885)",A,missing_chords
send the fire i90845,C:\Users\littl\Documents\Codex Projects\worship-song-finder\data\raw\opensong\send the fire i90845,Send the fire,,,"missing_author,missing_chords"
shackles i87150,C:\Users\littl\Documents\Codex Projects\worship-song-finder\data\raw\opensong\shackles i87150,Shackles,"Warryn Campbell, Trecina Atkins-Campbell, Erica Atkins-Campbell",Am,missing_chords
shadow step i47551,C:\Users\littl\Documents\Codex Projects\worship-song-finder\data\raw\opensong\shadow step i47551,Shadow Step,Hillsong United,,missing_chords
shake another hand i64658,C:\Users\littl\Documents\Codex Projects\worship-song-finder\data\raw\opensong\shake another hand i64658,Shake Another Hand,,,"missing_author,missing_chords"
shall we gather by the river i1546,C:\Users\littl\Documents\Codex Projects\worship-song-finder\data\raw\opensong\shall we gather by the river i1546,Shall we gather by the river?,,,"missing_author,missing_chords"
shalom i102392,C:\Users\littl\Documents\Codex Projects\worship-song-finder\data\raw\opensong\shalom i102392,Shalom,,E,missing_author
shape of your heart i47569,C:\Users\littl\Documents\Codex Projects\worship-song-finder\data\raw\opensong\shape of your heart i47569,Shape Of Your Heart,Hillsong United,,missing_chords
sheltered in the arms i64286,C:\Users\littl\Documents\Codex Projects\worship-song-finder\data\raw\opensong\sheltered in the arms i64286,Sheltered in the Arms,,,"missing_author,missing_chords"
shepherd i46538,C:\Users\littl\Documents\Codex Projects\worship-song-finder\data\raw\opensong\shepherd i46538,Shepherd,Bethel Music,C#m,missing_chords
shepherd of my soul i48372,C:\Users\littl\Documents\Codex Projects\worship-song-finder\data\raw\opensong\shepherd of my soul i48372,Shepherd Of My Soul,Rivers & Robots,,missing_chords
shepherd of my thankful heart i58,C:\Users\littl\Documents\Codex Projects\worship-song-finder\data\raw\opensong\shepherd of my thankful heart i58,Shepherd of My Thankful Heart,,,"missing_author,missing_chords"
shepherds come i1971,C:\Users\littl\Documents\Codex Projects\worship-song-finder\data\raw\opensong\shepherds come i1971,Shepherds Come,,D,missing_author
shine on me i64126,C:\Users\littl\Documents\Codex Projects\worship-song-finder\data\raw\opensong\shine on me i64126,Shine on me,,,"missing_author,missing_chords"
shouts of joy i2733,C:\Users\littl\Documents\Codex Projects\worship-song-finder\data\raw\opensong\shouts of joy i2733,Shouts Of Joy,Joanie Murphy,,missing_chords
show me your ways i97420,C:\Users\littl\Documents\Codex Projects\worship-song-finder\data\raw\opensong\show me your ways i97420,Show me Your Ways,Chris Bowater,,missing_chords
shut in with god i63941,C:\Users\littl\Documents\Codex Projects\worship-song-finder\data\raw\opensong\shut in with god i63941,Shut in with God,,,"missing_author,missing_chords"
silent night i1471,C:\Users\littl\Documents\Codex Projects\worship-song-finder\data\raw\opensong\silent night i1471,Silent Night,,A,missing_author
simple gospel i98025,C:\Users\littl\Documents\Codex Projects\worship-song-finder\data\raw\opensong\simple gospel i98025,Simple gospel,,A,missing_author
since i saw my name i64339,C:\Users\littl\Documents\Codex Projects\worship-song-finder\data\raw\opensong\since i saw my name i64339,Since I saw my Name,,F,"missing_author,missing_chords"
sing for joy in the lord i88697,C:\Users\littl\Documents\Codex Projects\worship-song-finder\data\raw\opensong\sing for joy in the lord i88697,Sing for joy in The Lord,John C. Sellers,,missing_chords
sing hallelujah to the lord i1567,C:\Users\littl\Documents\Codex Projects\worship-song-finder\data\raw\opensong\sing hallelujah to the lord i1567,Sing hallelujah to the Lord,Linda Strassen,Am,missing_chords
sing hosanna i92387,C:\Users\littl\Documents\Codex Projects\worship-song-finder\data\raw\opensong\sing hosanna i92387,Sing hosanna,,C,missing_author
sing them over again to me wonderful words of life i54601,C:\Users\littl\Documents\Codex Projects\worship-song-finder\data\raw\opensong\sing them over again to me wonderful words of life i54601,"Sing them over again to me, wonderful words of life",,,"missing_author,missing_chords"
sing to the lord i90453,C:\Users\littl\Documents\Codex Projects\worship-song-finder\data\raw\opensong\sing to the lord i90453,Sing To The Lord,,,"missing_author,missing_chords"
sing wherever i go i95018,C:\Users\littl\Documents\Codex Projects\worship-song-finder\data\raw\opensong\sing wherever i go i95018,Sing Wherever I go,,,"missing_author,missing_chords"
so glad im yours lord i63949,C:\Users\littl\Documents\Codex Projects\worship-song-finder\data\raw\opensong\so glad im yours lord i63949,"So glad I'm yours, Lord",,,"missing_author,missing_chords"
so many times i51888,C:\Users\littl\Documents\Codex Projects\worship-song-finder\data\raw\opensong\so many times i51888,So many times,,,"missing_author,missing_chords"
so you would come i89976,C:\Users\littl\Documents\Codex Projects\worship-song-finder\data\raw\opensong\so you would come i89976,So You Would Come,Russell Fragar,,missing_chords
soar i95181,C:\Users\littl\Documents\Codex Projects\worship-song-finder\data\raw\opensong\soar i95181,Soar,Inna Zvyagintseva,,missing_chords
softly and tenderly i64394,C:\Users\littl\Documents\Codex Projects\worship-song-finder\data\raw\opensong\softly and tenderly i64394,Softly And Tenderly,,E,"missing_author,missing_chords"
soli deo gloria to god alone be the glory i52683,C:\Users\littl\Documents\Codex Projects\worship-song-finder\data\raw\opensong\soli deo gloria to god alone be the glory i52683,Soli Deo Gloria. To God alone be the glory,,,"missing_author,missing_chords"
somebodys knocking at your door i87978,C:\Users\littl\Documents\Codex Projects\worship-song-finder\data\raw\opensong\somebodys knocking at your door i87978,Somebody's Knocking At Your Door,African American Spiritual,,missing_chords
something keeps holding me i64221,C:\Users\littl\Documents\Codex Projects\worship-song-finder\data\raw\opensong\something keeps holding me i64221,Something keeps holding me,,F,missing_author
somethings falling down on me i91958,C:\Users\littl\Documents\Codex Projects\worship-song-finder\data\raw\opensong\somethings falling down on me i91958,Somethings falling down on me,José Luis Reyes,,missing_chords
somewhere in the middle i53545,C:\Users\littl\Documents\Codex Projects\worship-song-finder\data\raw\opensong\somewhere in the middle i53545,Somewhere in the middle,,,"missing_author,missing_chords"
song from heaven i88207,C:\Users\littl\Documents\Codex Projects\worship-song-finder\data\raw\opensong\song from heaven i88207,Song From Heaven,Chris Falson,,missing_chords
song to the nations i108577,C:\Users\littl\Documents\Codex Projects\worship-song-finder\data\raw\opensong\song to the nations i108577,Song to the Nations,,G,missing_author
soon and very soon i64002,C:\Users\littl\Documents\Codex Projects\worship-song-finder\data\raw\opensong\soon and very soon i64002,Soon and very soon,,E,missing_author
soon and very soon i7572,C:\Users\littl\Documents\Codex Projects\worship-song-finder\data\raw\opensong\soon and very soon i7572,Soon and Very Soon,Andraé Crouch,,missing_chords
sovereign over us i97294,C:\Users\littl\Documents\Codex Projects\worship-song-finder\data\raw\opensong\sovereign over us i97294,Sovereign Over Us,Michael W. Smith,,missing_chords
speak to the storm i64260,C:\Users\littl\Documents\Codex Projects\worship-song-finder\data\raw\opensong\speak to the storm i64260,Speak to the storm,,C,missing_author
spirit and the bride i87494,C:\Users\littl\Documents\Codex Projects\worship-song-finder\data\raw\opensong\spirit and the bride i87494,Spirit And The Bride,Tom Dickson,,missing_chords
spirit move over me i101471,C:\Users\littl\Documents\Codex Projects\worship-song-finder\data\raw\opensong\spirit move over me i101471,Spirit Move Over Me,,,"missing_author,missing_chords"
spirit of god move i64580,C:\Users\littl\Documents\Codex Projects\worship-song-finder\data\raw\opensong\spirit of god move i64580,Spirit of God move,,D,"missing_author,missing_chords"
spirit of the living god fall afresh on me i40606,C:\Users\littl\Documents\Codex Projects\worship-song-finder\data\raw\opensong\spirit of the living god fall afresh on me i40606,Spirit of the Living God fall afresh on me,,,"missing_author,missing_chords"
spirit of the sovereign god i106891,C:\Users\littl\Documents\Codex Projects\worship-song-finder\data\raw\opensong\spirit of the sovereign god i106891,Spirit of the Sovereign God,"Andy Park, Lindell Cooley, Hosanna! Music",,missing_chords
spirit of the sovereign lord i106966,C:\Users\littl\Documents\Codex Projects\worship-song-finder\data\raw\opensong\spirit of the sovereign lord i106966,Spirit Of The Sovereign Lord,,Gm,"missing_author,missing_chords"
spirit song i7840,C:\Users\littl\Documents\Codex Projects\worship-song-finder\data\raw\opensong\spirit song i7840,Spirit Song,John Wimber,,missing_chords
splinters and stones i47552,C:\Users\littl\Documents\Codex Projects\worship-song-finder\data\raw\opensong\splinters and stones i47552,Splinters and Stones,Hillsong United,,missing_chords
spread all over the earth i87294,C:\Users\littl\Documents\Codex Projects\worship-song-finder\data\raw\opensong\spread all over the earth i87294,Spread all over the Earth,Һemidәm һәdә,,missing_chords
stand up stand up for jesus i7158,C:\Users\littl\Documents\Codex Projects\worship-song-finder\data\raw\opensong\stand up stand up for jesus i7158,"Stand up, Stand up for Jesus","C. Barny Robertson, George Duffield, George J. Webb",,missing_chords
standing in the need of prayer i90759,C:\Users\littl\Documents\Codex Projects\worship-song-finder\data\raw\opensong\standing in the need of prayer i90759,Standing in the need of prayer,,,"missing_author,missing_chords"
standing on holy ground i25,C:\Users\littl\Documents\Codex Projects\worship-song-finder\data\raw\opensong\standing on holy ground i25,Standing On Holy Ground,,,"missing_author,missing_chords"
step by step i97349,C:\Users\littl\Documents\Codex Projects\worship-song-finder\data\raw\opensong\step by step i97349,Step by Step,,G,missing_author
still my soul be still i87250,C:\Users\littl\Documents\Codex Projects\worship-song-finder\data\raw\opensong\still my soul be still i87250,Still my Soul be still,,G,missing_author
still rolling stones i54983,C:\Users\littl\Documents\Codex Projects\worship-song-finder\data\raw\opensong\still rolling stones i54983,Still Rolling Stones,,,"missing_author,missing_chords"
strong in us feat brian johnson i46914,C:\Users\littl\Documents\Codex Projects\worship-song-finder\data\raw\opensong\strong in us feat brian johnson i46914,Strong In Us (feat: Brian Johnson),Bethel Music,,missing_chords
strong tower i55299,C:\Users\littl\Documents\Codex Projects\worship-song-finder\data\raw\opensong\strong tower i55299,Strong Tower,,,"missing_author,missing_chords"
stronger than i101563,C:\Users\littl\Documents\Codex Projects\worship-song-finder\data\raw\opensong\stronger than i101563,Stronger than,,D,missing_author
such an awesome god i106953,C:\Users\littl\Documents\Codex Projects\worship-song-finder\data\raw\opensong\such an awesome god i106953,Such an Awesome God,,,"missing_author,missing_chords"
such an awesome god i107882,C:\Users\littl\Documents\Codex Projects\worship-song-finder\data\raw\opensong\such an awesome god i107882,Such an Awesome God,,,"missing_author,missing_chords"
such love pure as the whitest snow i851,C:\Users\littl\Documents\Codex Projects\worship-song-finder\data\raw\opensong\such love pure as the whitest snow i851,"Such Love, Pure as the Whitest Snow",,D,missing_author
sufficient for today i109434,C:\Users\littl\Documents\Codex Projects\worship-song-finder\data\raw\opensong\sufficient for today i109434,Sufficient For Today,"Dante Bowe, Maryanne J. George, Tiffany Hammer, Pat Barrett, Joe L. Barnes",,missing_chords
super wonderful i54835,C:\Users\littl\Documents\Codex Projects\worship-song-finder\data\raw\opensong\super wonderful i54835,Super Wonderful,,,"missing_author,missing_chords"
surely the presence of the lord i63965,C:\Users\littl\Documents\Codex Projects\worship-song-finder\data\raw\opensong\surely the presence of the lord i63965,Surely the presence of the Lord,,C,"missing_author,missing_chords"
surrender i55301,C:\Users\littl\Documents\Codex Projects\worship-song-finder\data\raw\opensong\surrender i55301,Surrender,,,"missing_author,missing_chords"
survivor i104197,C:\Users\littl\Documents\Codex Projects\worship-song-finder\data\raw\opensong\survivor i104197,Survivor,"Zach Williams,, Bryan Fowler,, Jonathan Smith",,missing_chords
sweet anointing i64603,C:\Users\littl\Documents\Codex Projects\worship-song-finder\data\raw\opensong\sweet anointing i64603,Sweet Anointing,,,"missing_author,missing_chords"
sweet by and by i64397,C:\Users\littl\Documents\Codex Projects\worship-song-finder\data\raw\opensong\sweet by and by i64397,Sweet By And By,,,"missing_author,missing_chords"
sweet heaven in view i101517,C:\Users\littl\Documents\Codex Projects\worship-song-finder\data\raw\opensong\sweet heaven in view i101517,Sweet heaven in view,,,"missing_author,missing_chords"
swing low i42430,C:\Users\littl\Documents\Codex Projects\worship-song-finder\data\raw\opensong\swing low i42430,Swing Low,,D,missing_author
