file_name,file_path,title,author,key,reason
let it rain i40608,C:\Users\littl\Documents\Codex Projects\worship-song-finder\data\raw\opensong\let it rain i40608,Let it rain,"Michael W. Smith, Michael Farron",Em,missing_chords
let me nov wander i48643,C:\Users\littl\Documents\Codex Projects\worship-song-finder\data\raw\opensong\let me nov wander i48643,Let Me nov Wander,Jonathan Ogden,,missing_chords
let others see jesus in you i93160,C:\Users\littl\Documents\Codex Projects\worship-song-finder\data\raw\opensong\let others see jesus in you i93160,Let others see Jesus in you,B.B. McKinney,,missing_chords
let our gladness have no end i11161,C:\Users\littl\Documents\Codex Projects\worship-song-finder\data\raw\opensong\let our gladness have no end i11161,Let Our Gladness Have No End,"Bohemian, Zavorka, Tobias",G,missing_chords
let praises rise i100794,C:\Users\littl\Documents\Codex Projects\worship-song-finder\data\raw\opensong\let praises rise i100794,Let Praises Rise,ORU Live Worship,Em,missing_chords
let the celebration begin i98848,C:\Users\littl\Documents\Codex Projects\worship-song-finder\data\raw\opensong\let the celebration begin i98848,Let the celebration begin,Planetshakers,,missing_chords
let the heavens open i110600,C:\Users\littl\Documents\Codex Projects\worship-song-finder\data\raw\opensong\let the heavens open i110600,Let The Heavens Open,"Kari Jobe, Cody Carnes",,missing_chords
let the living water flow i64413,C:\Users\littl\Documents\Codex Projects\worship-song-finder\data\raw\opensong\let the living water flow i64413,Let the Living Water Flow,,,"missing_author,missing_chords"
let the lower lights be burning i76361,C:\Users\littl\Documents\Codex Projects\worship-song-finder\data\raw\opensong\let the lower lights be burning i76361,Let the Lower Lights Be Burning,Philip Paul Bliss,,missing_chords
let the nations be glad i1753,C:\Users\littl\Documents\Codex Projects\worship-song-finder\data\raw\opensong\let the nations be glad i1753,Let the Nations Be Glad,,,"missing_author,missing_chords"
let the weight of your glory fall i90712,C:\Users\littl\Documents\Codex Projects\worship-song-finder\data\raw\opensong\let the weight of your glory fall i90712,Let the weight of Your Glory fall,Paul Wilbur,Am,missing_chords
let the worshippers arise i64541,C:\Users\littl\Documents\Codex Projects\worship-song-finder\data\raw\opensong\let the worshippers arise i64541,Let the worshippers arise,,G,missing_author
let there be joy i21,C:\Users\littl\Documents\Codex Projects\worship-song-finder\data\raw\opensong\let there be joy i21,Let There Be Joy,,D,missing_author
let there be love i1536,C:\Users\littl\Documents\Codex Projects\worship-song-finder\data\raw\opensong\let there be love i1536,Let There Be Love,Dave Bilbrough,,missing_chords
let us adore i51179,C:\Users\littl\Documents\Codex Projects\worship-song-finder\data\raw\opensong\let us adore i51179,Let us adore,Julius Chajes,,missing_chords
let us adore i98960,C:\Users\littl\Documents\Codex Projects\worship-song-finder\data\raw\opensong\let us adore i98960,Let Us Adore,,,"missing_author,missing_chords"
let us exalt his name i51704,C:\Users\littl\Documents\Codex Projects\worship-song-finder\data\raw\opensong\let us exalt his name i51704,Let us exalt His name,Stuart Dauermann,,missing_chords
let us shine for you i96513,C:\Users\littl\Documents\Codex Projects\worship-song-finder\data\raw\opensong\let us shine for you i96513,Let us shine for you,Hillsong Worship,,missing_chords
let us sing unto the lord i98106,C:\Users\littl\Documents\Codex Projects\worship-song-finder\data\raw\opensong\let us sing unto the lord i98106,Let us sing unto the LORD,Jamie Hilsden,,missing_chords
let your glory fall i103,C:\Users\littl\Documents\Codex Projects\worship-song-finder\data\raw\opensong\let your glory fall i103,Let your glory fall,,G,missing_author
let your glory fall i55308,C:\Users\littl\Documents\Codex Projects\worship-song-finder\data\raw\opensong\let your glory fall i55308,Let Your Glory Fall,,,"missing_author,missing_chords"
let your glory fill this house i99032,C:\Users\littl\Documents\Codex Projects\worship-song-finder\data\raw\opensong\let your glory fill this house i99032,Let Your Glory Fill This House,,,"missing_author,missing_chords"
let your kingdom come feat chris jackson i54771,C:\Users\littl\Documents\Codex Projects\worship-song-finder\data\raw\opensong\let your kingdom come feat chris jackson i54771,Let Your Kingdom Come (feat. Chris Jackson),,,"missing_author,missing_chords"
let your living water i1637,C:\Users\littl\Documents\Codex Projects\worship-song-finder\data\raw\opensong\let your living water i1637,Let your living water,,,"missing_author,missing_chords"
let your mercy rain i42277,C:\Users\littl\Documents\Codex Projects\worship-song-finder\data\raw\opensong\let your mercy rain i42277,Let Your Mercy Rain,"Chris Tomlin, Ed Cash, Jesse Reeves",,missing_chords
let your spirit come fall upon me now i29134,C:\Users\littl\Documents\Codex Projects\worship-song-finder\data\raw\opensong\let your spirit come fall upon me now i29134,Let Your Spirit come fall Upon me now,,,"missing_author,missing_chords"
let your word be born i64608,C:\Users\littl\Documents\Codex Projects\worship-song-finder\data\raw\opensong\let your word be born i64608,Let Your Word Be Born,,C,missing_author
lets talk about jesus i63936,C:\Users\littl\Documents\Codex Projects\worship-song-finder\data\raw\opensong\lets talk about jesus i63936,Let's talk about Jesus,,E,missing_author
lettered love i48157,C:\Users\littl\Documents\Codex Projects\worship-song-finder\data\raw\opensong\lettered love i48157,Lettered Love,Hillsong Worship,,missing_chords
life i47571,C:\Users\littl\Documents\Codex Projects\worship-song-finder\data\raw\opensong\life i47571,Life,Hillsong United,,missing_chords
life is good i42280,C:\Users\littl\Documents\Codex Projects\worship-song-finder\data\raw\opensong\life is good i42280,Life Is Good,,E,missing_author
lift high the banners of love i89720,C:\Users\littl\Documents\Codex Projects\worship-song-finder\data\raw\opensong\lift high the banners of love i89720,Lift High The Banners Of Love,Richard Gillard,Am,missing_chords
lift high the name of jesus i107976,C:\Users\littl\Documents\Codex Projects\worship-song-finder\data\raw\opensong\lift high the name of jesus i107976,Lift high the name of Jesus,"Fionan Debarra, Keith Getty, Edmond Martin Cash, Kristyn Getty",,missing_chords
lift me higher i64324,C:\Users\littl\Documents\Codex Projects\worship-song-finder\data\raw\opensong\lift me higher i64324,Lift me higher,,,"missing_author,missing_chords"
lift up your hands when you cant i48465,C:\Users\littl\Documents\Codex Projects\worship-song-finder\data\raw\opensong\lift up your hands when you cant i48465,Lift Up Your Hands (When You Can't),Mark Schultz,,missing_chords
lift up your heads i1686,C:\Users\littl\Documents\Codex Projects\worship-song-finder\data\raw\opensong\lift up your heads i1686,Lift up your heads,Graham Kendrick,,missing_chords
lifted me high again i108781,C:\Users\littl\Documents\Codex Projects\worship-song-finder\data\raw\opensong\lifted me high again i108781,Lifted me high again,,F,missing_author
light of the world i48948,C:\Users\littl\Documents\Codex Projects\worship-song-finder\data\raw\opensong\light of the world i48948,Light Of The World,Planetshakers,,missing_chords
light surrounding you i75721,C:\Users\littl\Documents\Codex Projects\worship-song-finder\data\raw\opensong\light surrounding you i75721,Light Surrounding You,Evermore,,missing_chords
light up the sky i108990,C:\Users\littl\Documents\Codex Projects\worship-song-finder\data\raw\opensong\light up the sky i108990,Light Up the Sky,The afters,Bm,missing_chords
light will dawn i48379,C:\Users\littl\Documents\Codex Projects\worship-song-finder\data\raw\opensong\light will dawn i48379,Light Will Dawn,Rivers & Robots,,missing_chords
like a fire i87126,C:\Users\littl\Documents\Codex Projects\worship-song-finder\data\raw\opensong\like a fire i87126,Like a fire,Planetshakers,,missing_chords
like the woman i88170,C:\Users\littl\Documents\Codex Projects\worship-song-finder\data\raw\opensong\like the woman i88170,Like The Woman,Stacey Swalley,,missing_chords
limitless i54642,C:\Users\littl\Documents\Codex Projects\worship-song-finder\data\raw\opensong\limitless i54642,Limitless,,,"missing_author,missing_chords"
lion and the lamb i92325,C:\Users\littl\Documents\Codex Projects\worship-song-finder\data\raw\opensong\lion and the lamb i92325,Lion and The Lamb,New wine,,missing_chords
lion i103899,C:\Users\littl\Documents\Codex Projects\worship-song-finder\data\raw\opensong\lion i103899,Lion,,,"missing_author,missing_chords"
lion of judah i109115,C:\Users\littl\Documents\Codex Projects\worship-song-finder\data\raw\opensong\lion of judah i109115,Lion of Judah,,,"missing_author,missing_chords"
listen closely o my heart i3832,C:\Users\littl\Documents\Codex Projects\worship-song-finder\data\raw\opensong\listen closely o my heart i3832,"Listen Closely, O My Heart",Turgay Üçal,,missing_chords
little brown church in the wildwood i7650,C:\Users\littl\Documents\Codex Projects\worship-song-finder\data\raw\opensong\little brown church in the wildwood i7650,Little brown church in the wildwood,,,"missing_author,missing_chords"
little is much when god is in it i64188,C:\Users\littl\Documents\Codex Projects\worship-song-finder\data\raw\opensong\little is much when god is in it i64188,Little is much when God is in it,,,"missing_author,missing_chords"
lo god to heavn ascendeth i11164,C:\Users\littl\Documents\Codex Projects\worship-song-finder\data\raw\opensong\lo god to heavn ascendeth i11164,"Lo, God To Heav'n Ascendeth","Crüger, Johann (1598-1662), Sacer, Gottfried Wilhelm (1635-1699)",F,missing_chords
lo he comes with clouds descending i11165,C:\Users\littl\Documents\Codex Projects\worship-song-finder\data\raw\opensong\lo he comes with clouds descending i11165,Lo! He Comes With Clouds Descending,"Olivers, Thomas (1725-1799), Cennick, John (1718-1755), Wesley, Charles (1707-1788)",G,missing_chords
longing for jesus i64083,C:\Users\littl\Documents\Codex Projects\worship-song-finder\data\raw\opensong\longing for jesus i64083,Longing for Jesus,,G,missing_author
look and live ive got a message i6907,C:\Users\littl\Documents\Codex Projects\worship-song-finder\data\raw\opensong\look and live ive got a message i6907,Look and live/ I've got a Message,,,"missing_author,missing_chords"
look at what the lord has done i110012,C:\Users\littl\Documents\Codex Projects\worship-song-finder\data\raw\opensong\look at what the lord has done i110012,Look At What The Lord Has Done,,G,missing_author
look down o lord from heaven behold i11167,C:\Users\littl\Documents\Codex Projects\worship-song-finder\data\raw\opensong\look down o lord from heaven behold i11167,"Look Down, O Lord, From Heaven Behold","from Erfurt Enchiridion, Luther, Martin (1483-1546)",F,missing_chords
look to jesus i42285,C:\Users\littl\Documents\Codex Projects\worship-song-finder\data\raw\opensong\look to jesus i42285,Look to Jesus,,E,missing_author
look to the lamb of god i92830,C:\Users\littl\Documents\Codex Projects\worship-song-finder\data\raw\opensong\look to the lamb of god i92830,Look to the Lamb of God,H. G. Jackson,,missing_chords
look to the skies i1603,C:\Users\littl\Documents\Codex Projects\worship-song-finder\data\raw\opensong\look to the skies i1603,Look to the Skies,"Graham Kendrick, David Peacock",,missing_chords
look what lord has done i90741,C:\Users\littl\Documents\Codex Projects\worship-song-finder\data\raw\opensong\look what lord has done i90741,Look What Lord Has Done,"Karen Wheaton, 1992",,missing_chords
lord dismiss us with thy blessing i11168,C:\Users\littl\Documents\Codex Projects\worship-song-finder\data\raw\opensong\lord dismiss us with thy blessing i11168,"Lord, Dismiss Us With Thy Blessing","Smart, Henry Thomas (1813-1879), Fawcett, John (1740-1817), Thring, Godfrey (1823-1903)",C,missing_chords
lord god thy praise we sing i11292,C:\Users\littl\Documents\Codex Projects\worship-song-finder\data\raw\opensong\lord god thy praise we sing i11292,"Lord God, Thy Praise We Sing","Latin, Luther, Martin (1483-1546)",C,missing_chords
lord i come before your throne of grace i78,C:\Users\littl\Documents\Codex Projects\worship-song-finder\data\raw\opensong\lord i come before your throne of grace i78,Lord I Come Before Your Throne of Grace,,,"missing_author,missing_chords"
lord i lift your name i64420,C:\Users\littl\Documents\Codex Projects\worship-song-finder\data\raw\opensong\lord i lift your name i64420,Lord I lift your Name,,G,missing_author
lord i need a miracle i90704,C:\Users\littl\Documents\Codex Projects\worship-song-finder\data\raw\opensong\lord i need a miracle i90704,"Lord, I need a miracle",Heritage Singers,,missing_chords
lord im grateful i23,C:\Users\littl\Documents\Codex Projects\worship-song-finder\data\raw\opensong\lord im grateful i23,Lord I'm Grateful,,,"missing_author,missing_chords"
lord jesus christ very word of god i9512,C:\Users\littl\Documents\Codex Projects\worship-song-finder\data\raw\opensong\lord jesus christ very word of god i9512,"Lord Jesus Christ, Very Word of God",Gürkan Çamsun,,missing_chords
lord jesus think on me i11170,C:\Users\littl\Documents\Codex Projects\worship-song-finder\data\raw\opensong\lord jesus think on me i11170,Lord Jesus Think On Me,"from William Daman's Psalter, 1579, Synesius of Cyrene (375-430)",Ab,missing_chords
lord keep us steadfast in thy word i11171,C:\Users\littl\Documents\Codex Projects\worship-song-finder\data\raw\opensong\lord keep us steadfast in thy word i11171,"Lord, Keep Us Steadfast in Thy Word","from Klug's Geistliche Lieder auffs new gebessert, Wittenberg, 1543, Luther, Martin (1483-1546)",G,missing_chords
lord lord lord youve surely been good to me i64124,C:\Users\littl\Documents\Codex Projects\worship-song-finder\data\raw\opensong\lord lord lord youve surely been good to me i64124,"Lord, Lord, Lord You've surely been good to me",,C,"missing_author,missing_chords"
lord most high i42288,C:\Users\littl\Documents\Codex Projects\worship-song-finder\data\raw\opensong\lord most high i42288,Lord Most High,,E,missing_author
lord of all i108591,C:\Users\littl\Documents\Codex Projects\worship-song-finder\data\raw\opensong\lord of all i108591,Lord of all,,Bb,missing_author
lord of all the earth i93145,C:\Users\littl\Documents\Codex Projects\worship-song-finder\data\raw\opensong\lord of all the earth i93145,Lord of all the earth,,,"missing_author,missing_chords"
lord of hosts i105274,C:\Users\littl\Documents\Codex Projects\worship-song-finder\data\raw\opensong\lord of hosts i105274,Lord of Hosts,Shane&Shane,,missing_chords
lord of my life i109830,C:\Users\littl\Documents\Codex Projects\worship-song-finder\data\raw\opensong\lord of my life i109830,Lord of My Life,,G,missing_author
lord of our life i11174,C:\Users\littl\Documents\Codex Projects\worship-song-finder\data\raw\opensong\lord of our life i11174,Lord Of Our Life,"from Poitiers Antiphoner, von Löwenstern, Matthäus Apelles (1594-1648)",F,missing_chords
lord prepare me i64102,C:\Users\littl\Documents\Codex Projects\worship-song-finder\data\raw\opensong\lord prepare me i64102,Lord prepare me,,E,missing_author
lord take my hand and lead me i11241,C:\Users\littl\Documents\Codex Projects\worship-song-finder\data\raw\opensong\lord take my hand and lead me i11241,Lord Take My Hand and Lead Me,"Silcher, Friedrich (1789-1860), von Hausmann, Julie Katharina (1826-1901)",F,missing_chords
lord thee i love with all my heart i11175,C:\Users\littl\Documents\Codex Projects\worship-song-finder\data\raw\opensong\lord thee i love with all my heart i11175,"Lord, Thee I Love with All My Heart","from Strassburg, Schalling, Martin (1532-1608)",Bb,missing_chords
lord we love you i92342,C:\Users\littl\Documents\Codex Projects\worship-song-finder\data\raw\opensong\lord we love you i92342,Lord We Love You,Jerry Sinclair,,missing_chords
lord we love you i97653,C:\Users\littl\Documents\Codex Projects\worship-song-finder\data\raw\opensong\lord we love you i97653,Lord We Love You,Jerry Sinclair,,missing_chords
lord who the night you were betrayed i11265,C:\Users\littl\Documents\Codex Projects\worship-song-finder\data\raw\opensong\lord who the night you were betrayed i11265,"Lord, Who the Night You Were Betrayed","Monk, William Henry (1823-1889), Turton, William H. (1856-1938)",D,missing_chords
lord you are always by my side i1892,C:\Users\littl\Documents\Codex Projects\worship-song-finder\data\raw\opensong\lord you are always by my side i1892,Lord You are always by my side,,,"missing_author,missing_chords"
lord you are an amazing god i99,C:\Users\littl\Documents\Codex Projects\worship-song-finder\data\raw\opensong\lord you are an amazing god i99,Lord You Are an Amazing God,,,"missing_author,missing_chords"
lord you are so precious to me i64280,C:\Users\littl\Documents\Codex Projects\worship-song-finder\data\raw\opensong\lord you are so precious to me i64280,Lord you are so precious to me,,G,"missing_author,missing_chords"
lord youve set your throne between the cherubim i2315,C:\Users\littl\Documents\Codex Projects\worship-song-finder\data\raw\opensong\lord youve set your throne between the cherubim i2315,"Lord, You've Set Your Throne Between the Cherubim","Özge Talas, Alev Çeliktemur",,missing_chords
lost in wonder i48642,C:\Users\littl\Documents\Codex Projects\worship-song-finder\data\raw\opensong\lost in wonder i48642,Lost In Wonder,Jonathan Ogden,,missing_chords
love came down at christmas i106880,C:\Users\littl\Documents\Codex Projects\worship-song-finder\data\raw\opensong\love came down at christmas i106880,Love Came Down At Christmas,,D,missing_author
love came down i46901,C:\Users\littl\Documents\Codex Projects\worship-song-finder\data\raw\opensong\love came down i46901,Love Came Down,"Bethel Music, Brian Johnson",,missing_chords
love let loose i55102,C:\Users\littl\Documents\Codex Projects\worship-song-finder\data\raw\opensong\love let loose i55102,Love Let Loose,,,"missing_author,missing_chords"
love lifted me i7661,C:\Users\littl\Documents\Codex Projects\worship-song-finder\data\raw\opensong\love lifted me i7661,Love Lifted Me,,G,missing_author
love love love love the gospel in a word is love i11516,C:\Users\littl\Documents\Codex Projects\worship-song-finder\data\raw\opensong\love love love love the gospel in a word is love i11516,"Love, Love, Love, Love. The gospel in a word is love",,,"missing_author,missing_chords"
love of my lord i88199,C:\Users\littl\Documents\Codex Projects\worship-song-finder\data\raw\opensong\love of my lord i88199,Love Of My Lord,Ted Sandquist,,missing_chords
love them like jesus i53546,C:\Users\littl\Documents\Codex Projects\worship-song-finder\data\raw\opensong\love them like jesus i53546,Love Them Like Jesus,,,"missing_author,missing_chords"
love you so much i108989,C:\Users\littl\Documents\Codex Projects\worship-song-finder\data\raw\opensong\love you so much i108989,Love You So Much,,D,missing_author
made to love i52505,C:\Users\littl\Documents\Codex Projects\worship-song-finder\data\raw\opensong\made to love i52505,Made to Love,,,"missing_author,missing_chords"
made to worship i42298,C:\Users\littl\Documents\Codex Projects\worship-song-finder\data\raw\opensong\made to worship i42298,Made To Worship,"Chris Tomlin, Ed Cash, Stephan Conley Sharp",,missing_chords
magnificent i108451,C:\Users\littl\Documents\Codex Projects\worship-song-finder\data\raw\opensong\magnificent i108451,Magnificent,,G,missing_author
magnify the lord with me psalm 34 i64653,C:\Users\littl\Documents\Codex Projects\worship-song-finder\data\raw\opensong\magnify the lord with me psalm 34 i64653,Magnify the Lord with me (Psalm 34),,C,missing_author
majesty king of eternity i64941,C:\Users\littl\Documents\Codex Projects\worship-song-finder\data\raw\opensong\majesty king of eternity i64941,Majesty King of Eternity,Hillsong United,,missing_chords
majesty worship his majesty i853,C:\Users\littl\Documents\Codex Projects\worship-song-finder\data\raw\opensong\majesty worship his majesty i853,"Majesty, Worship His Majesty",Jack Hayford,Em,missing_chords
make a joyful noise unto the lord i64743,C:\Users\littl\Documents\Codex Projects\worship-song-finder\data\raw\opensong\make a joyful noise unto the lord i64743,Make a Joyful Noise unto The Lord,Rusell L. Lowe,,missing_chords
make known i45,C:\Users\littl\Documents\Codex Projects\worship-song-finder\data\raw\opensong\make known i45,Make Known,,,"missing_author,missing_chords"
make me a channel of your peace i90075,C:\Users\littl\Documents\Codex Projects\worship-song-finder\data\raw\opensong\make me a channel of your peace i90075,Make me a channel of your peace,,,"missing_author,missing_chords"
make me an instrument i64255,C:\Users\littl\Documents\Codex Projects\worship-song-finder\data\raw\opensong\make me an instrument i64255,Make Me An Instrument,,,"missing_author,missing_chords"
make room in your heart i102844,C:\Users\littl\Documents\Codex Projects\worship-song-finder\data\raw\opensong\make room in your heart i102844,Make room in your heart,,E,missing_author
make you famous i110027,C:\Users\littl\Documents\Codex Projects\worship-song-finder\data\raw\opensong\make you famous i110027,Make you Famous,,C,missing_author
may god bestow on us his grace i11179,C:\Users\littl\Documents\Codex Projects\worship-song-finder\data\raw\opensong\may god bestow on us his grace i11179,May God Bestow on Us His Grace,"German, Luther, Martin (1483-1546)",C,missing_chords
may god unto us gracious be i11179,C:\Users\littl\Documents\Codex Projects\worship-song-finder\data\raw\opensong\may god unto us gracious be i11179,May God Unto Us Gracious Be,"German, Luther, Martin (1483-1546)",C,missing_chords
medley clap your hands all ye people i1591,C:\Users\littl\Documents\Codex Projects\worship-song-finder\data\raw\opensong\medley clap your hands all ye people i1591,"Medley: Clap your hands, all ye people",Charlie LeBlanc,,missing_chords
medley leaningthere is powerglory glory hallelujah i64183,C:\Users\littl\Documents\Codex Projects\worship-song-finder\data\raw\opensong\medley leaningthere is powerglory glory hallelujah i64183,Medley - Leaning/There is Power/Glory Glory Hallelujah,,,"missing_author,missing_chords"
memories of galilee i93295,C:\Users\littl\Documents\Codex Projects\worship-song-finder\data\raw\opensong\memories of galilee i93295,Memories of Galilee,Robert Morris,,missing_chords
mercy and majesty i48593,C:\Users\littl\Documents\Codex Projects\worship-song-finder\data\raw\opensong\mercy and majesty i48593,Mercy and Majesty,Brian Johnson & Jenn Johnson,,missing_chords
mercy i48461,C:\Users\littl\Documents\Codex Projects\worship-song-finder\data\raw\opensong\mercy i48461,Mercy,Amanda Cook,,missing_chords
messiah is the king of kings i64085,C:\Users\littl\Documents\Codex Projects\worship-song-finder\data\raw\opensong\messiah is the king of kings i64085,Messiah is the King of kings,,D,"missing_author,missing_chords"
michael row the boat ashore i51797,C:\Users\littl\Documents\Codex Projects\worship-song-finder\data\raw\opensong\michael row the boat ashore i51797,Michael Row the Boat Ashore,African American Spiritual,,missing_chords
midnight cry i64525,C:\Users\littl\Documents\Codex Projects\worship-song-finder\data\raw\opensong\midnight cry i64525,Midnight cry,,,"missing_author,missing_chords"
mighty is the power of the cross i42309,C:\Users\littl\Documents\Codex Projects\worship-song-finder\data\raw\opensong\mighty is the power of the cross i42309,Mighty Is the Power of the Cross,"Chris Tomlin, Jesse Reeves, Shawn Craig",,missing_chords
mighty name of jesus i109664,C:\Users\littl\Documents\Codex Projects\worship-song-finder\data\raw\opensong\mighty name of jesus i109664,Mighty Name Of Jesus,,,"missing_author,missing_chords"
missionary anthem i103709,C:\Users\littl\Documents\Codex Projects\worship-song-finder\data\raw\opensong\missionary anthem i103709,Missionary Anthem,,Am,"missing_author,missing_chords"
missionary anthem i99006,C:\Users\littl\Documents\Codex Projects\worship-song-finder\data\raw\opensong\missionary anthem i99006,Missionary Anthem,,Am,"missing_author,missing_chords"
moon and stars i54772,C:\Users\littl\Documents\Codex Projects\worship-song-finder\data\raw\opensong\moon and stars i54772,Moon and stars,,,"missing_author,missing_chords"
more and more of you i47022,C:\Users\littl\Documents\Codex Projects\worship-song-finder\data\raw\opensong\more and more of you i47022,More and More of You,Selah,,missing_chords
more love more power i824,C:\Users\littl\Documents\Codex Projects\worship-song-finder\data\raw\opensong\more love more power i824,"More Love, More Power",Jude Del Hierro,Em,missing_chords
more love to thee i11181,C:\Users\littl\Documents\Codex Projects\worship-song-finder\data\raw\opensong\more love to thee i11181,More Love to Thee,"Doane, William Howard (1832-1915), Prentis, Elizabeth Payson (1818-1878)",Ab,missing_chords
more than conquerors i64257,C:\Users\littl\Documents\Codex Projects\worship-song-finder\data\raw\opensong\more than conquerors i64257,More Than Conquerors,,,"missing_author,missing_chords"
more than enough i48525,C:\Users\littl\Documents\Codex Projects\worship-song-finder\data\raw\opensong\more than enough i48525,More Than Enough,Rivers & Robots,,missing_chords
more than enough i98339,C:\Users\littl\Documents\Codex Projects\worship-song-finder\data\raw\opensong\more than enough i98339,More than Enough,,,"missing_author,missing_chords"
more than ever before lord i love you i64071,C:\Users\littl\Documents\Codex Projects\worship-song-finder\data\raw\opensong\more than ever before lord i love you i64071,"More than ever before, Lord I love You!",,D,"missing_author,missing_chords"
morning noontime i64336,C:\Users\littl\Documents\Codex Projects\worship-song-finder\data\raw\opensong\morning noontime i64336,"Morning, noon-time",,E,"missing_author,missing_chords"
